{
  "run_id": "run_20261005_100000",
  "started_at": "2026-10-05T09:02:41Z",
  "repeat_index": 1,
  "app_version": "1.0.0-characterization",
  "git_commit": "24aa0f0-impl",
  "host_tool_versions": {
    "python": "3.10.11"
  },
  "device_identity": {
    "device_unit_id": "OPPO_A5_2020_UNIT_01",
    "known_specification": {
      "manufacturer": "OPPO",
      "model": "OPPO A5 2020",
      "ram_variant": "3 GB",
      "excluded_variants": [
        "4 GB",
        "6 GB"
      ],
      "source": "researcher-provided manufacturer specification",
      "storage": "64 GB",
      "soc": "Qualcomm Snapdragon 665",
      "gpu": "Adreno 610",
      "android_launch_version": "Android 9 / ColorOS"
    },
    "observed": [
      {
        "metric": "manufacturer",
        "state": "UNAVAILABLE",
        "report_status": "UNAVAILABLE",
        "value": null,
        "unit": null,
        "source": "Build.MANUFACTURER / getprop",
        "min_api": null,
        "condition": null,
        "verified": false,
        "verification_method": "device_observation",
        "evidence_ref": null,
        "observed_at": null,
        "error_message": null,
        "notes": null
      },
      {
        "metric": "model",
        "state": "UNAVAILABLE",
        "report_status": "UNAVAILABLE",
        "value": null,
        "unit": null,
        "source": "Build.MODEL / getprop",
        "min_api": null,
        "condition": null,
        "verified": false,
        "verification_method": "device_observation",
        "evidence_ref": null,
        "observed_at": null,
        "error_message": null,
        "notes": null
      },
      {
        "metric": "total_ram_mb",
        "state": "UNAVAILABLE",
        "report_status": "UNAVAILABLE",
        "value": null,
        "unit": "MB",
        "source": "ActivityManager.MemoryInfo.totalMem / /proc/meminfo",
        "min_api": null,
        "condition": null,
        "verified": false,
        "verification_method": "device_observation",
        "evidence_ref": null,
        "observed_at": null,
        "error_message": null,
        "notes": null
      },
      {
        "metric": "soc_model",
        "state": "UNAVAILABLE",
        "report_status": "UNAVAILABLE",
        "value": null,
        "unit": null,
        "source": "Build.SOC_MODEL (API>=31) / /proc/cpuinfo",
        "min_api": 31,
        "condition": null,
        "verified": false,
        "verification_method": "device_observation",
        "evidence_ref": null,
        "observed_at": null,
        "error_message": null,
        "notes": null
      },
      {
        "metric": "gpu_renderer",
        "state": "UNAVAILABLE",
        "report_status": "UNAVAILABLE",
        "value": null,
        "unit": null,
        "source": "GLES20.glGetString(GL_RENDERER) / EGL",
        "min_api": null,
        "condition": null,
        "verified": false,
        "verification_method": "device_observation",
        "evidence_ref": null,
        "observed_at": null,
        "error_message": null,
        "notes": null
      },
      {
        "metric": "api_level",
        "state": "UNAVAILABLE",
        "report_status": "UNAVAILABLE",
        "value": null,
        "unit": null,
        "source": "Build.VERSION.SDK_INT",
        "min_api": null,
        "condition": null,
        "verified": false,
        "verification_method": "device_observation",
        "evidence_ref": null,
        "observed_at": null,
        "error_message": null,
        "notes": null
      },
      {
        "metric": "release_version",
        "state": "UNAVAILABLE",
        "report_status": "UNAVAILABLE",
        "value": null,
        "unit": null,
        "source": "Build.VERSION.RELEASE",
        "min_api": null,
        "condition": null,
        "verified": false,
        "verification_method": "device_observation",
        "evidence_ref": null,
        "observed_at": null,
        "error_message": null,
        "notes": null
      },
      {
        "metric": "service_PowerManager",
        "state": "NOT_TESTED",
        "report_status": "REQUIRES PILOT VALIDATION",
        "value": null,
        "unit": null,
        "source": "Context.getSystemService(PowerManager)",
        "min_api": null,
        "condition": null,
        "verified": false,
        "verification_method": "service_get_check",
        "evidence_ref": null,
        "observed_at": null,
        "error_message": null,
        "notes": null
      },
      {
        "metric": "service_HardwarePropertiesManager",
        "state": "NOT_TESTED",
        "report_status": "REQUIRES PILOT VALIDATION",
        "value": null,
        "unit": null,
        "source": "Context.getSystemService(HardwarePropertiesManager)",
        "min_api": null,
        "condition": null,
        "verified": false,
        "verification_method": "service_get_check",
        "evidence_ref": null,
        "observed_at": null,
        "error_message": null,
        "notes": null
      },
      {
        "metric": "service_CameraManager",
        "state": "NOT_TESTED",
        "report_status": "REQUIRES PILOT VALIDATION",
        "value": null,
        "unit": null,
        "source": "Context.getSystemService(CameraManager)",
        "min_api": null,
        "condition": null,
        "verified": false,
        "verification_method": "service_get_check",
        "evidence_ref": null,
        "observed_at": null,
        "error_message": null,
        "notes": null
      },
      {
        "metric": "service_ActivityManager",
        "state": "NOT_TESTED",
        "report_status": "REQUIRES PILOT VALIDATION",
        "value": null,
        "unit": null,
        "source": "Context.getSystemService(ActivityManager)",
        "min_api": null,
        "condition": null,
        "verified": false,
        "verification_method": "service_get_check",
        "evidence_ref": null,
        "observed_at": null,
        "error_message": null,
        "notes": null
      },
      {
        "metric": "service_BatteryManager",
        "state": "NOT_TESTED",
        "report_status": "REQUIRES PILOT VALIDATION",
        "value": null,
        "unit": null,
        "source": "Context.getSystemService(BatteryManager)",
        "min_api": null,
        "condition": null,
        "verified": false,
        "verification_method": "service_get_check",
        "evidence_ref": null,
        "observed_at": null,
        "error_message": null,
        "notes": null
      }
    ],
    "variant_check": {
      "metric": "variant_check",
      "state": "UNAVAILABLE",
      "report_status": "UNAVAILABLE",
      "value": null,
      "unit": "variant",
      "source": "MemoryInfo.totalMem RAM range check",
      "min_api": null,
      "condition": null,
      "verified": false,
      "verification_method": "observed_ram_range_verification",
      "evidence_ref": null,
      "observed_at": null,
      "error_message": null,
      "notes": "Total RAM not yet observed on device."
    }
  },
  "telemetry": [
    {
      "dimension": "battery",
      "results": [
        {
          "metric": "battery_level_percent",
          "state": "UNAVAILABLE",
          "report_status": "UNAVAILABLE",
          "value": null,
          "unit": "percent",
          "source": "BatteryManager.EXTRA_LEVEL / ACTION_BATTERY_CHANGED",
          "min_api": null,
          "condition": null,
          "verified": false,
          "verification_method": "battery_broadcast_check",
          "evidence_ref": null,
          "observed_at": null,
          "error_message": null,
          "notes": null
        },
        {
          "metric": "battery_voltage",
          "state": "UNAVAILABLE",
          "report_status": "UNAVAILABLE",
          "value": null,
          "unit": "mV",
          "source": "BatteryManager.EXTRA_VOLTAGE",
          "min_api": null,
          "condition": null,
          "verified": false,
          "verification_method": "battery_broadcast_check",
          "evidence_ref": null,
          "observed_at": null,
          "error_message": null,
          "notes": null
        },
        {
          "metric": "battery_temperature",
          "state": "UNAVAILABLE",
          "report_status": "UNAVAILABLE",
          "value": null,
          "unit": "degC",
          "source": "BatteryManager.EXTRA_TEMPERATURE / 10.0",
          "min_api": null,
          "condition": null,
          "verified": false,
          "verification_method": "battery_broadcast_check",
          "evidence_ref": null,
          "observed_at": null,
          "error_message": null,
          "notes": null
        },
        {
          "metric": "battery_current_now",
          "state": "UNAVAILABLE",
          "report_status": "UNAVAILABLE",
          "value": null,
          "unit": "mA",
          "source": "BatteryManager.BATTERY_PROPERTY_CURRENT_NOW",
          "min_api": null,
          "condition": null,
          "verified": false,
          "verification_method": "battery_property_check",
          "evidence_ref": null,
          "observed_at": null,
          "error_message": null,
          "notes": "Sentinel or unsupported readings are assigned state UNAVAILABLE with value=null."
        },
        {
          "metric": "battery_charge_counter",
          "state": "UNAVAILABLE",
          "report_status": "UNAVAILABLE",
          "value": null,
          "unit": "uAh",
          "source": "BatteryManager.BATTERY_PROPERTY_CHARGE_COUNTER",
          "min_api": null,
          "condition": null,
          "verified": false,
          "verification_method": "battery_property_check",
          "evidence_ref": null,
          "observed_at": null,
          "error_message": null,
          "notes": null
        }
      ],
      "resource_state_input": true,
      "reliability": "REQUIRES PILOT VALIDATION"
    },
    {
      "dimension": "memory",
      "results": [
        {
          "metric": "available_memory_mb",
          "state": "UNAVAILABLE",